{
  "profile": {
    "id": "sample-translations",
    "schemaVersion": 1,
    "behaviorVersion": 1
  },
  "importId": "import-1",
  "sourceSetId": "source-set",
  "sourceSnapshotId": "snapshot-1",
  "targetLanguage": "zh-CN",
  "languageEvidence": "user-confirmed",
  "nativeScope": {
    "namespace": "Example.Mod",
    "policy": {
      "id": "sample-native-key",
      "schemaVersion": 1,
      "behaviorVersion": 1
    }
  },
  "artifacts": [
    {
      "id": "translations",
      "logicalPath": "i18n/zh.json",
      "role": "translation",
      "sha256": "5d8c9f1a1fc8d2bb291588dfb4a69382a6531b92606050c5c0ee21bd5d7fd191",
      "utf8": "﻿{\r\n // fixed 中文 😀\r\n \"Key\": \"译文 👩🏽‍💻 é\",\r\n \"Other\": \"\",\r\n}\r\n"
    }
  ],
  "declaredLanguage": "zh",
  "entries": [
    {
      "id": "entry-0",
      "text": "译文 👩🏽‍💻 é",
      "source": {
        "artifactId": "translations",
        "range": {
          "encoding": "utf8-byte",
          "start": 37,
          "end": 65
        }
      },
      "nativeIdentity": {
        "namespace": "Example.Mod",
        "value": "key",
        "policy": {
          "id": "sample-native-key",
          "schemaVersion": 1,
          "behaviorVersion": 1
        },
        "display": {
          "value": "Key",
          "source": {
            "artifactId": "translations",
            "range": {
              "encoding": "utf8-byte",
              "start": 30,
              "end": 35
            }
          }
        }
      }
    },
    {
      "id": "entry-1",
      "text": "",
      "source": {
        "artifactId": "translations",
        "range": {
          "encoding": "utf8-byte",
          "start": 78,
          "end": 80
        }
      },
      "nativeIdentity": {
        "namespace": "Example.Mod",
        "value": "other",
        "policy": {
          "id": "sample-native-key",
          "schemaVersion": 1,
          "behaviorVersion": 1
        },
        "display": {
          "value": "Other",
          "source": {
            "artifactId": "translations",
            "range": {
              "encoding": "utf8-byte",
              "start": 69,
              "end": 76
            }
          }
        }
      }
    }
  ],
  "order": [
    "entry-0",
    "entry-1"
  ]
}
